{
  "format": "pyWellSFM.ScenarioData",
  "version": "1.0",
  "name": "ScenarioInline",
  "accumulationModel": {
    "format": "pyWellSFM.AccumulationModelData",
    "version": "1.0",
    "accumulationModel": {
      "name": "ScenarioAccModel",
      "elements": {
        "sand": {
          "accumulationRate": 100.0,
          "model": {
            "modelType": "Gaussian",
            "stddevFactor": 0.2
          }
        }
      }
    }
  },
  "eustaticCurve": {
    "format": "pyWellSFM.CurveData",
    "version": "1.0",
    "curve": {
      "xAxisName": "Age",
      "yAxisName": "Eustatism",
      "interpolationMethod": "linear",
      "data": [
        {"x": 0.0, "y": 0.0},
        {"x": 10.0, "y": 5.0}
      ]
    }
  }
}
